{
  "$schema": "https://json-schema.org/draft/2020-12/schema",
  "$id": "https://yanhuo-youpu.local/schemas/evidence-package.schema.json",
  "title": "Recipe Evidence Package",
  "type": "object",
  "additionalProperties": false,
  "required": ["recipeId", "recipeName", "category", "createdAt", "sources", "ragEvidence", "notes"],
  "properties": {
    "recipeId": { "type": "string", "pattern": "^(cn|west)-[0-9]{3}$" },
    "recipeName": { "type": "string", "minLength": 1 },
    "category": { "type": "string", "enum": ["chinese", "western"] },
    "createdAt": { "type": "string", "format": "date-time" },
    "sources": {
      "type": "array",
      "minItems": 1,
      "items": { "$ref": "#/$defs/sourceEvidence" }
    },
    "sourceMode": { "type": "string", "enum": ["multi_source", "single_source"] },
    "singleSourceReason": { "type": "string", "minLength": 1 },
    "selectedSourceUrl": { "type": "string", "format": "uri" },
    "selectionReason": { "type": "string", "minLength": 1 },
    "ragEvidence": {
      "type": "array",
      "items": {
        "type": "object",
        "additionalProperties": false,
        "required": ["chunkId", "documentId", "sourceName", "chunkType", "content"],
        "properties": {
          "chunkId": { "type": "string", "minLength": 1 },
          "documentId": { "type": "string", "minLength": 1 },
          "sourceName": { "type": "string", "minLength": 1 },
          "chunkType": { "type": "string", "enum": ["summary", "ingredients", "steps", "technique", "tips"] },
          "content": { "type": "string", "minLength": 1 },
          "similarity": { "type": ["number", "null"] }
        }
      }
    },
    "notes": { "type": "array", "items": { "type": "string" } }
  },
  "allOf": [
    {
      "if": { "properties": { "sources": { "maxItems": 1 } } },
      "then": {
        "required": ["sourceMode", "singleSourceReason"],
        "properties": { "sourceMode": { "const": "single_source" } }
      }
    },
    {
      "if": {
        "required": ["sourceMode"],
        "properties": { "sourceMode": { "const": "multi_source" } }
      },
      "then": { "properties": { "sources": { "minItems": 2 } } }
    },
    {
      "if": { "properties": { "sources": { "contains": { "properties": { "complete": { "const": false } }, "required": ["complete"] } } } },
      "then": { "properties": { "recipeId": { "const": "cn-011" } } }
    },
    {
      "if": { "properties": { "sources": { "contains": { "properties": { "media": { "required": ["heroOnlyAuthorization"] } }, "required": ["media"] } } } },
      "then": { "properties": { "recipeId": { "const": "west-031" } } }
    }
  ],
  "$defs": {
    "ingredient": {
      "type": "object",
      "additionalProperties": true,
      "required": ["name", "raw"],
      "properties": {
        "name": { "type": "string", "minLength": 1 },
        "amount": { "type": ["string", "null"] },
        "raw": { "type": "string", "minLength": 1 }
      }
    },
    "step": {
      "type": "object",
      "additionalProperties": true,
      "required": ["order", "instruction"],
      "properties": {
        "order": { "type": "integer", "minimum": 1 },
        "instruction": { "type": "string", "minLength": 1 },
        "duration": { "type": ["string", "null"] },
        "heat": { "type": ["string", "null"] }
      }
    },
    "sourceEvidence": {
      "type": "object",
      "additionalProperties": false,
      "required": ["sourceName", "sourceType", "url", "documentId", "retrievalMethod", "complete", "ingredients", "steps", "technique", "tips", "rawExcerpt"],
      "properties": {
        "sourceName": { "type": "string", "minLength": 1 },
        "sourceType": { "type": "string", "enum": ["website", "book"] },
        "url": { "type": ["string", "null"] },
        "documentId": { "type": "string", "minLength": 1 },
        "retrievalMethod": { "type": "string", "minLength": 1 },
        "complete": { "type": "boolean" },
        "userAuthorizedIncomplete": {
          "type": "object",
          "additionalProperties": false,
          "required": ["authorization", "recipeId", "sourceUrl", "omissions"],
          "properties": {
            "authorization": { "const": "user_explicit_2026-10-07_cn-011" },
            "recipeId": { "const": "cn-011" },
            "sourceUrl": { "const": "https://www.douguo.com/cookbook/2331633.html" },
            "omissions": { "type": "array", "minItems": 1, "items": { "type": "string", "minLength": 1 } }
          }
        },
        "recipeDependencies": { "type": "array", "items": { "type": "object", "required": ["recipeId", "name", "url"], "properties": { "recipeId": { "type": "string" }, "name": { "type": "string" }, "url": { "type": "string", "format": "uri" } } } },
        "ingredients": { "type": "array", "minItems": 1, "items": { "$ref": "#/$defs/ingredient" } },
        "steps": { "type": "array", "minItems": 2, "items": { "$ref": "#/$defs/step" } },
        "technique": { "type": "array", "items": { "type": "string" } },
        "tips": { "type": "array", "items": { "type": "string" } },
        "rawExcerpt": { "type": "string", "minLength": 1 },
        "bookTitle": { "type": ["string", "null"] },
        "pageStart": { "type": ["integer", "null"], "minimum": 1 },
        "pageEnd": { "type": ["integer", "null"], "minimum": 1 },
        "location": { "type": ["string", "null"] },
        "selectionAssessment": { "$ref": "#/$defs/selectionAssessment" },
        "media": { "$ref": "#/$defs/sourceMedia" }
      },
      "allOf": [
        {
          "if": { "properties": { "complete": { "const": false } }, "required": ["complete"] },
          "then": { "required": ["userAuthorizedIncomplete"], "properties": { "url": { "const": "https://www.douguo.com/cookbook/2331633.html" } } }
        }
      ]
    },
    "selectionAssessment": {
      "type": "object",
      "additionalProperties": false,
      "required": ["qualifies", "ingredientCoverage", "stepCoverage", "internalCoherence", "heroImages", "mappedStepImages", "stepImageCoverage"],
      "properties": {
        "qualifies": { "type": "boolean" },
        "ingredientCoverage": { "type": "string", "enum": ["complete", "incomplete"] },
        "stepCoverage": { "type": "string", "enum": ["complete", "incomplete"] },
        "internalCoherence": { "type": "string", "enum": ["coherent", "conflicted"] },
        "heroImages": { "type": "integer", "minimum": 0 },
        "mappedStepImages": { "type": "integer", "minimum": 0 },
        "stepImageCoverage": { "type": "number", "minimum": 0, "maximum": 1 },
        "ingredientCount": { "type": "integer", "minimum": 0 },
        "executableStepCount": { "type": "integer", "minimum": 0 },
        "notes": { "type": "array", "items": { "type": "string" } }
      }
    },
    "sourceMedia": {
      "type": "object",
      "additionalProperties": false,
      "required": ["recipePageUrl", "mediaPageUrl", "sourceName", "author", "rightsNotice", "reuseLicense", "hero", "steps"],
      "properties": {
        "recipePageUrl": { "type": "string", "format": "uri" },
        "mediaPageUrl": { "type": ["string", "null"], "format": "uri" },
        "sourceName": { "type": "string", "minLength": 1 },
        "author": { "type": ["string", "null"] },
        "rightsNotice": { "type": ["string", "null"] },
        "reuseLicense": { "type": ["string", "null"] },
        "repositoryCopyAuthorized": { "type": "boolean" },
        "heroOnlyAuthorization": { "const": "user_explicit_2026-10-07_west-031" },
        "hero": { "$ref": "#/$defs/mediaItem" },
        "steps": {
          "type": "array",
          "minItems": 0,
          "items": {
            "allOf": [
              { "$ref": "#/$defs/mediaItem" },
              {
                "type": "object",
                "required": ["stepOrder", "adjacentText"],
                "properties": {
                  "stepOrder": { "type": "integer", "minimum": 1 },
                  "adjacentText": { "type": "string", "minLength": 1 }
                }
              }
            ]
          }
        }
      },
      "allOf": [{ "if": { "required": ["heroOnlyAuthorization"] }, "then": { "properties": { "recipePageUrl": { "const": "https://www.seriouseats.com/basic-ragu-bolognese-recipe" } } }, "else": { "properties": { "steps": { "minItems": 1 } } } }]
    },
    "mediaItem": {
      "type": "object",
      "additionalProperties": true,
      "required": ["httpStatus", "contentType"],
      "properties": {
        "url": { "type": "string", "format": "uri" },
        "originalUrl": { "type": "string", "format": "uri" },
        "repositoryPath": { "type": "string", "pattern": "^assets/dishes/sources/" },
        "sha256": { "type": "string", "pattern": "^[a-f0-9]{64}$" },
        "httpStatus": { "const": 200 },
        "contentType": { "type": "string", "pattern": "^image/" }
      },
      "anyOf": [
        { "required": ["url"] },
        { "required": ["originalUrl"] }
      ]
    }
  }
}
