{
  "recipeId": "cn-030",
  "recipeName": "蚂蚁上树",
  "category": "chinese",
  "createdAt": "2026-10-08T07:14:35.262630+00:00",
  "sources": [
    {
      "sourceName": "HowToCook",
      "sourceType": "website",
      "url": "https://github.com/Anduin2017/HowToCook/blob/a2d45c6984dff9ee941da0e7c452f7965965d962/dishes/meat_dish/%E8%9A%82%E8%9A%81%E4%B8%8A%E6%A0%91.md",
      "documentId": "5b5ce493-18f1-45da-a20e-ee36d7a89025",
      "retrievalMethod": "GitHub immutable raw Markdown via configured local HTTP proxy; no access-control bypass",
      "complete": true,
      "ingredients": [
        {
          "name": "红薯粉丝",
          "raw": "红薯粉丝 80g（干重）",
          "amount": null,
          "sourceSection": "计算"
        },
        {
          "name": "猪肉末",
          "raw": "猪肉末 150g",
          "amount": null,
          "sourceSection": "计算"
        },
        {
          "name": "郫县豆瓣酱",
          "raw": "郫县豆瓣酱 15g",
          "amount": null,
          "sourceSection": "计算"
        },
        {
          "name": "生抽",
          "raw": "生抽 10ml",
          "amount": null,
          "sourceSection": "计算"
        },
        {
          "name": "老抽",
          "raw": "老抽 5ml",
          "amount": null,
          "sourceSection": "计算"
        },
        {
          "name": "食用油",
          "raw": "食用油 10ml",
          "amount": null,
          "sourceSection": "计算"
        },
        {
          "name": "蒜末",
          "raw": "蒜末 10g",
          "amount": null,
          "sourceSection": "计算"
        },
        {
          "name": "姜末",
          "raw": "姜末 5g",
          "amount": null,
          "sourceSection": "计算"
        },
        {
          "name": "小葱",
          "raw": "小葱（可选）",
          "amount": null,
          "sourceSection": "必备原料和工具"
        },
        {
          "name": "清水",
          "raw": "清水 300ml（用于煮粉丝）",
          "amount": null,
          "sourceSection": "计算"
        },
        {
          "name": "白胡椒粉",
          "raw": "可加入 0.5g 白胡椒粉调味，风味更佳",
          "amount": null,
          "sourceSection": "操作/附加内容"
        },
        {
          "name": "牛肉末（替代猪肉末）",
          "raw": "猪肉末（或牛肉末）",
          "amount": null,
          "sourceSection": "必备原料和工具"
        }
      ],
      "steps": [
        {
          "order": 1,
          "instruction": "红薯粉丝提前泡软，泡水时间为 20 分钟，备用",
          "duration": null,
          "heat": null,
          "sourceOrder": 1
        },
        {
          "order": 2,
          "instruction": "将蒜、姜分别剁碎，备用",
          "duration": null,
          "heat": null,
          "sourceOrder": 2
        },
        {
          "order": 3,
          "instruction": "锅烧热，加入 10ml 食用油，加入蒜末、姜末炒香",
          "duration": null,
          "heat": null,
          "sourceOrder": 3
        },
        {
          "order": 4,
          "instruction": "加入猪肉末翻炒至**肉色发白且微微出油**",
          "duration": null,
          "heat": null,
          "sourceOrder": 4
        },
        {
          "order": 5,
          "instruction": "加入郫县豆瓣酱，炒至**红油析出**",
          "duration": null,
          "heat": null,
          "sourceOrder": 5
        },
        {
          "order": 6,
          "instruction": "加入生抽和老抽，翻炒均匀",
          "duration": null,
          "heat": null,
          "sourceOrder": 6
        },
        {
          "order": 7,
          "instruction": "倒入 300ml 清水，煮沸",
          "duration": null,
          "heat": null,
          "sourceOrder": 7
        },
        {
          "order": 8,
          "instruction": "放入泡软沥干的粉丝，用筷子轻轻拨动防止粘连",
          "duration": null,
          "heat": null,
          "sourceOrder": 8
        },
        {
          "order": 9,
          "instruction": "中小火煮约 5 分钟，直至粉丝**完全吸收汤汁**、呈现微微收干状态",
          "duration": null,
          "heat": null,
          "sourceOrder": 9
        },
        {
          "order": 10,
          "instruction": "依据口味可撒入小葱末，关火装盘",
          "duration": null,
          "heat": null,
          "sourceOrder": 10
        }
      ],
      "technique": [
        "每次制作前需要确定计划做几份。一份正好够 2 个人吃。\n\n每份：\n\n- 红薯粉丝 80g（干重）\n- 猪肉末 150g\n- 郫县豆瓣酱 15g\n- 生抽 10ml\n- 老抽 5ml\n- 食用油 10ml\n- 蒜末 10g\n- 姜末 5g\n- 清水 300ml（用于煮粉丝）"
      ],
      "tips": [
        "- 粉丝不建议煮太久，易断且口感变差；若时间过长汤汁应适当减少\n- 郫县豆瓣酱含盐量较高，可根据口味酌情减少生抽用量\n- 可加入 0.5g 白胡椒粉调味，风味更佳\n\n如果您遵循本指南的制作流程而发现有问题或可以改进的流程，请提出 Issue 或 Pull request 。"
      ],
      "rawExcerpt": "# 蚂蚁上树的做法\n\n蚂蚁上树是一道经典的川味家常菜，咸香微辣，粉丝软滑吸汁，肉末细嫩鲜香。以红薯粉丝和肉末为主料，富含碳水化合物与蛋白质，能快速补充能量。制作难度中等，步骤清晰，对新手比较友好，全程约需 20 分钟即可完成。\n\n预估烹饪难度：★★★\n\n预估卡路里：791 大卡\n\n## 必备原料和工具\n\n- 红薯粉丝\n- 猪肉末（或牛肉末）\n- 郫县豆瓣酱\n- 生抽\n- 老抽\n- 食用油\n- 蒜末、姜末\n- 小葱（可选）\n\n## 计算\n\n每次制作前需要确定计划做几份。一份正好够 2 个人吃。\n\n每份：\n\n- 红薯粉丝 80g（干重）\n- 猪肉末 150g\n- 郫县豆瓣酱 15g\n- 生抽 10ml\n- 老抽 5ml\n- 食用油 10ml\n- 蒜末 10g\n- 姜末 5g\n- 清水 300ml（用于煮粉丝）\n\n## 操作\n\n1. 红薯粉丝提前泡软，泡水时间为 20 分钟，备用\n2. 将蒜、姜分别剁碎，备用\n3. 锅烧热，加入 10ml 食用油，加入蒜末、姜末炒香\n4. 加入猪肉末翻炒至**肉色发白且微微出油**\n5. 加入郫县豆瓣酱，炒至**红油析出**\n6. 加入生抽和老抽，翻炒均匀\n7. 倒入 300ml 清水，煮沸\n8. 放入泡软沥干的粉丝，用筷子轻轻拨动防止粘连\n9. 中小火煮约 5 分钟，直至粉丝**完全吸收汤汁**、呈现微微收干状态\n10. 依据口味可撒入小葱末，关火装盘\n\n## 附加内容\n\n- 粉丝不建议煮太久，易断且口感变差；若时间过长汤汁应适当减少\n- 郫县豆瓣酱含盐量较高，可根据口味酌情减少生抽用量\n- 可加入 0.5g 白胡椒粉调味，风味更佳\n\n如果您遵循本指南的制作流程而发现有问题或可以改进的流程，请提出 Issue 或 Pull request 。\n"
    }
  ],
  "sourceMode": "single_source",
  "singleSourceReason": "User explicitly directed exclusive HowToCook source and exact upstream transcription.",
  "selectedSourceUrl": "https://github.com/Anduin2017/HowToCook/blob/a2d45c6984dff9ee941da0e7c452f7965965d962/dishes/meat_dish/%E8%9A%82%E8%9A%81%E4%B8%8A%E6%A0%91.md",
  "selectionReason": "上游菜谱文件名与指定菜名完全一致。",
  "ragEvidence": [
    {
      "chunkId": "4b91b593-2e38-48ea-9011-e8c9c8e6eb29",
      "documentId": "5b5ce493-18f1-45da-a20e-ee36d7a89025",
      "sourceName": "HowToCook",
      "chunkType": "summary",
      "content": "菜名：蚂蚁上树\n简介：# 蚂蚁上树的做法 蚂蚁上树是一道经典的川味家常菜，咸香微辣，粉丝软滑吸汁，肉末细嫩鲜香。以红薯粉丝和肉末为主料，富含碳水化合物与蛋白质，能快速补充能量。制作难度中等，步骤清晰，对新手比较友好，全程约需 20 分钟即可完成。 预估烹饪难度：★★★ 预估卡路里：791 大卡",
      "similarity": 0.327152877493461
    },
    {
      "chunkId": "8571b0a8-2a27-4eb3-b8cd-9bd596cff91c",
      "documentId": "5b5ce493-18f1-45da-a20e-ee36d7a89025",
      "sourceName": "HowToCook",
      "chunkType": "tips",
      "content": "菜名：蚂蚁上树\n- - 粉丝不建议煮太久，易断且口感变差；若时间过长汤汁应适当减少 - 郫县豆瓣酱含盐量较高，可根据口味酌情减少生抽用量 - 可加入 0.5g 白胡椒粉调味，风味更佳 如果您遵循本指南的制作流程而发现有问题或可以改进的流程，请提出 Issue 或 Pull request 。",
      "similarity": 0.316182713736134
    },
    {
      "chunkId": "c61f1762-8912-4f2c-8073-01a22730f928",
      "documentId": "5b5ce493-18f1-45da-a20e-ee36d7a89025",
      "sourceName": "HowToCook",
      "chunkType": "technique",
      "content": "菜名：蚂蚁上树\n- 每次制作前需要确定计划做几份。一份正好够 2 个人吃。 每份： - 红薯粉丝 80g（干重） - 猪肉末 150g - 郫县豆瓣酱 15g - 生抽 10ml - 老抽 5ml - 食用油 10ml - 蒜末 10g - 姜末 5g - 清水 300ml（用于煮粉丝）",
      "similarity": 0.26106203380412
    },
    {
      "chunkId": "87bf7f78-2720-4081-8d08-27af05658d19",
      "documentId": "5b5ce493-18f1-45da-a20e-ee36d7a89025",
      "sourceName": "HowToCook",
      "chunkType": "ingredients",
      "content": "菜名：蚂蚁上树\n- 红薯粉丝 80g（干重）\n- 猪肉末 150g\n- 郫县豆瓣酱 15g\n- 生抽 10ml\n- 老抽 5ml\n- 食用油 10ml\n- 蒜末 10g\n- 姜末 5g\n- 小葱（可选）\n- 清水 300ml（用于煮粉丝）\n- 可加入 0.5g 白胡椒粉调味，风味更佳\n- 猪肉末（或牛肉末）",
      "similarity": 0.255034089688552
    },
    {
      "chunkId": "af5503da-6324-4cc1-a3ee-823adc34d7c8",
      "documentId": "5b5ce493-18f1-45da-a20e-ee36d7a89025",
      "sourceName": "HowToCook",
      "chunkType": "steps",
      "content": "菜名：蚂蚁上树\n1. 红薯粉丝提前泡软，泡水时间为 20 分钟，备用\n2. 将蒜、姜分别剁碎，备用\n3. 锅烧热，加入 10ml 食用油，加入蒜末、姜末炒香\n4. 加入猪肉末翻炒至**肉色发白且微微出油**\n5. 加入郫县豆瓣酱，炒至**红油析出**\n6. 加入生抽和老抽，翻炒均匀\n7. 倒入 300ml 清水，煮沸\n8. 放入泡软沥干的粉丝，用筷子轻轻拨动防止粘连\n9. 中小火煮约 5 分钟，直至粉丝**完全吸收汤汁**、呈现微微收干状态\n10. 依据口味可撒入小葱末，关火装盘",
      "similarity": 0.235928721306584
    }
  ],
  "notes": [
    "用户明确要求仅用 HowToCook，原文完整转录；complete=true 表示上游文档完整抓取，不表示烹饪参数无遗漏。",
    "Source limitations: 小葱为可选未定量；附加内容提及可选白胡椒粉0.5g。 引言全程约20分钟，但操作单列泡粉20分钟及后续煮5分钟；保留原文不校正总时长。 本上游菜谱无图片，按用户要求不补造图片。 原文用量、工具、操作及措辞按原样保留；未说明的参数不补造。",
    "GitHub commit a2d45c6984dff9ee941da0e7c452f7965965d962; path dishes/meat_dish/蚂蚁上树.md",
    "媒体按原文位置保留；未要求映射的照片不伪称步骤图。",
    "Existing exact-name knowledge-base documents checked before source fetching: 0",
    "Structured ingredient audit corrected only explicit ingredient names and matching raw source text; no amount was invented.",
    "Existing exact-name knowledge-base documents checked before source fetching: 0"
  ]
}